{
  "steppps_version": "1.0",
  "kind": "dev-action",
  "id": "steppps://dev-action/dogfood-steppps-development",
  "space": {
    "realm": "virtual",
    "repo": "ternarybit-os",
    "paths": [
      "WISDOM.md",
      "tools/steppps_validate.py",
      "include/steppps/schema/dev/"
    ]
  },
  "time": {
    "created": "2026-07-15T16:15:00Z"
  },
  "event": {
    "action": "implement",
    "intent": "Make TBOS development eat its own STEPPPS dogfood.",
    "links": [
      "steppps://contract/dev-dogfood-v1"
    ]
  },
  "psychology": {
    "consciousness_level": "aware",
    "karma": {
      "total": 1
    }
  },
  "pixel": {
    "form": "json",
    "display_logic": "Render the dogfood lane as visible JSON development memory."
  },
  "prompt": {
    "source": "guru",
    "text": "Eat your own dogfood: all following TBOS development should be in STEPPPS.",
    "next_genai_prompt": "Use record-dev for the next TBOS development step and verify the dev chain."
  },
  "script": {
    "acts_on": ["space", "time", "event", "psychology", "pixel", "prompt", "script"],
    "commands": [
      "python3 tools/steppps_validate.py admit-dev include/steppps/schema/dev/examples/dogfood-steppps-development.example.json"
    ],
    "verification": [
      "python3 tools/steppps_validate.py verify-dev-chain"
    ]
  },
  "meta": {
    "owner": "steppps://agent/cx",
    "contract": "steppps://contract/dev-dogfood-v1"
  }
}
