{
  "steppps_version": "1.0",
  "kind": "dev-action",
  "id": "steppps://dev-action/next-dev-continuation-loop",
  "space": {
    "realm": "virtual",
    "repo": "ternarybit-os",
    "paths": [
      "tools/steppps_validate.py"
    ]
  },
  "time": {
    "created": "2026-07-16T00:21:33Z"
  },
  "event": {
    "action": "implement",
    "intent": "Add next-dev so TBOS can read the latest STEPPPS dev-action and print the next GenAI prompt, display logic, acted-on dimensions, and verification commands.",
    "links": [
      "include/steppps/schema/dev/contracts/dev-dogfood.v1.contract.json"
    ]
  },
  "psychology": {
    "consciousness_level": "aware",
    "karma": {
      "total": 1
    }
  },
  "pixel": {
    "form": "json",
    "display_logic": "Render this development action as an inspectable JSON record with STEPPPS dimensions visible."
  },
  "prompt": {
    "source": "guru",
    "text": "ok",
    "next_genai_prompt": "Continue the next TBOS change by creating or updating a STEPPPS dev-action, then verify the dev chain."
  },
  "script": {
    "acts_on": [
      "space",
      "time",
      "event",
      "psychology",
      "pixel",
      "prompt",
      "script"
    ],
    "commands": [
      "python3 tools/steppps_validate.py next-dev"
    ],
    "verification": [
      "python3 tools/steppps_validate.py verify-dev-chain"
    ]
  },
  "meta": {
    "owner": "steppps://agent/cx",
    "contract": "steppps://contract/dev-dogfood-v1"
  }
}
